{
  "$schema": "https://json-schema.org/draft/2020-12/schema",
  "$id": "https://project-rye.local/schemas/rye-skill.schema.json",
  "title": "Rye Skill Manifest",
  "type": "object",
  "required": ["id", "version", "label", "description", "source", "install", "requires", "capabilities"],
  "additionalProperties": false,
  "properties": {
    "$schema": {
      "type": "string",
      "description": "Optional pointer to this schema, so an editor validates the manifest as it is written. Every skill manifest in the repository carries it. Not data: nothing reads it, and sync_plugin_metadata.sh ignores it."
    },
    "id": { "type": "string", "minLength": 1 },
    "version": { "type": "string", "minLength": 1 },
    "label": { "type": "string", "minLength": 1 },
    "description": { "type": "string", "minLength": 1 },
    "source": {
      "type": "object",
      "required": ["type", "repo", "path"],
      "additionalProperties": true,
      "properties": {
        "type": { "type": "string", "minLength": 1 },
        "repo": { "type": "string", "minLength": 1 },
        "path": { "type": "string", "minLength": 1 }
      }
    },
    "install": {
      "type": "object",
      "required": ["manager", "command"],
      "additionalProperties": true,
      "properties": {
        "manager": { "type": "string", "minLength": 1 },
        "package": { "type": "string" },
        "skill": { "type": "string" },
        "command": { "type": "string", "minLength": 1 }
      }
    },
    "requires": {
      "type": "object",
      "additionalProperties": true,
      "properties": {
        "plugins": { "type": "array", "items": { "type": "string" } },
        "db_functions": { "type": "array", "items": { "type": "string" } },
        "db_views": { "type": "array", "items": { "type": "string" } },
        "cli_commands": { "type": "array", "items": { "type": "string" } }
      }
    },
    "capabilities": {
      "type": "array",
      "items": {
        "type": "object",
        "required": ["id", "label", "kind", "description", "read_only", "entrypoints"],
        "additionalProperties": true,
        "properties": {
          "id": { "type": "string", "minLength": 1 },
          "label": { "type": "string", "minLength": 1 },
          "kind": { "type": "string", "minLength": 1 },
          "description": { "type": "string", "minLength": 1 },
          "read_only": { "type": "boolean" },
          "requires": { "type": "object", "additionalProperties": true },
          "entrypoints": {
            "type": "array",
            "items": {
              "type": "object",
              "required": ["type"],
              "additionalProperties": true,
              "properties": {
                "type": { "type": "string", "minLength": 1 },
                "name": { "type": "string" },
                "command": { "type": "string" }
              }
            }
          }
        }
      }
    }
  }
}
