{
  "$schema": "../rye-skill.schema.json",
  "id": "rye-agent-ops",
  "version": "0.1.0",
  "label": "Rye Agent Ops",
  "description": "Operate Rye data safely for LLM agent read/write flows, domain table links, assertion keys, provenance, and auditable SQL.",
  "source": {
    "type": "github",
    "repo": "BLTGV/project-rye",
    "path": "skills/rye-agent-ops"
  },
  "install": {
    "manager": "vercel-skills",
    "package": "BLTGV/project-rye",
    "skill": "rye-agent-ops",
    "command": "npx skills add BLTGV/project-rye --skill rye-agent-ops"
  },
  "requires": {
    "plugins": [],
    "db_functions": ["rye_catalog", "rye_categories", "rye_settlers", "settle_gate", "agent_node_summary", "assertions_as_of", "link_record", "track_table", "record_event", "record_assertion", "schedule_deal_stage_change", "schedule_task_status_change", "schedule_milestone_status_change"],
    "db_views": ["current_valid_assertions"],
    "cli_commands": ["./scripts/rye status", "./scripts/rye catalog capabilities", "./scripts/rye categories --json", "./scripts/rye settlers --json", "./scripts/rye settle-gate <assertion-type>"]
  },
  "capabilities": [
    {
      "id": "operate-rye-safely",
      "label": "Operate Rye Safely",
      "kind": "skill",
      "description": "Guide agents through RLS setup, category discovery before a write, the settlement lookup before an accepted write, the admin gate on configuration writes, safe reads, auditable writes, provenance, and candidate promotion flows.",
      "read_only": false,
      "requires": {
        "db_functions": ["rye_categories", "rye_settlers", "settle_gate", "record_event", "record_assertion", "schedule_deal_stage_change", "schedule_task_status_change", "schedule_milestone_status_change", "link_record", "track_table"]
      },
      "entrypoints": [
        { "type": "skill_install", "command": "npx skills add BLTGV/project-rye --skill rye-agent-ops" },
        { "type": "db_function", "name": "rye_categories" },
        { "type": "db_function", "name": "rye_settlers" },
        { "type": "db_function", "name": "settle_gate" },
        { "type": "cli_command", "command": "./scripts/rye categories --json" },
        { "type": "cli_command", "command": "./scripts/rye settlers --json" },
        { "type": "cli_command", "command": "./scripts/rye settle-gate <assertion-type>" }
      ]
    }
  ]
}
